chunk_id,firm,year,page,chunk_text,contains_tier1,contains_tier2,rejection_reason,human_label_ai_relevant,original_label,recode_reason
REC040,THG,2022,56,"Board across audit, accounting, commercial initially serve as CFO and now as COO, a role chief financial officer of Dignity plc (having been remuneration committee and is a member of the and risk matters and also business strategy. which will allow him to drive the operations of the an independent non-executive director upon audit and nomination committees. Edward holds a degree from Ecole de Gillian is currently a non-executive director His strong financial background, depth of Group and build on the progress he has overseen appointment), a non-executive director of Griffin Management de Lyon (EM Lyon) Business of Ascential plc, Mothercare plc, Marlowe plc advisory experience and knowledge of the Group in the Group’s global fulfilment footprint.",False,False,No Tier 1 or Tier 2 keyword match, No,,
REC041,THG,2025,40,Embedding the transaction). the Company or the wider Group. A NED must regulatory and governance matters.,False,False,No Tier 1 or Tier 2 keyword match,No,,
REC042,THG,2022,112,"Maximilianstrasse 5480538 Munich. Ensco 818 Ltd 7459909 UK-2 Ltd 3550739 David Berryman Holdings Ltd 10392135 5. 517 West 100 North, Providence, UT 84332, USA.",False,False,No Tier 1 or Tier 2 keyword match,NO,,
REC043,Boohoo,2024,44,"long-term value and relationships with suppliers. • Updates were delivered through the Executive ESG and ESG Committees, giving its senior leadership team the opportunity to engage in key strategic decisions involving its supplier base. The board also held one of its monthly meetings in Italy, where it engaged with suppliers face to face.",False,False,No Tier 1 or Tier 2 keyword match, No,,
REC044,Boohoo,2021,42,"• The value of the award under the MIP is capped at £50 million of gross value before tax for Mahmud and Carol and £10 million for Neil in the event of achieving a market capitalisation of £7.554 billion (18% CAGR and 66% growth in market capitalisation from 16 June 2020). A market 2021 2020 capitalisation of less than £6.295 billion (11% CAGR) yields nil value. Total pay and Base salary Total pay and • The MIP provides for adjustments to be made for increases in market capitalisation arising from corporate events, such as the issue of shares for Pay data £000 Base salary benefits (annualised) benefits acquisitions, so that the benefits derived from the MIP only arise from organic growth and the MIP also provides clawback and malus provisions, Chief Executive remuneration 615 1,578 615 2,702 which allow repayment in defined circumstances.",False,False,No Tier 1 or Tier 2 keyword match,No,,
REC045,Boohoo,2023,127,"If the cost of acquisition is less than the fair value of the assets, the difference is recognised directly in the statement of comprehensive income. The Employee Benefit Trust is considered to be a special purpose entity in which the substance of the relationship is that of control by the group in order that the group may benefit from its control. The assets held by the trust are consolidated into the group.",False,False,No Tier 1 or Tier 2 keyword match,No,,
REC046,Redcare Pharmacy,2024,3,"We will do this by providing who is on this exciting journey with us for their enthusiasm, dedication and the best e-Rx redemption option in Germany, matched by pharmaceutical contribution. expertise and the most comprehensive assortment of non-Rx products in all our markets. We will invest in capacity, automation and technology to increase A word of special thanks also goes to our Supervisory Board members for access to affordable pharmacy products, services and expertise.",False,False,No Tier 1 or Tier 2 keyword match,No,YES,"Recoded on review: 'capacity, automation and technology' describes generic capital investment with no reference to any AI or machine-learning system. Recoded prior to computing recall."
REC047,Redcare Pharmacy,2025,65,"For our significant physical climate risks, we're reviewing our site resilience to extreme Governance, scope and accountability. weather (e.g. heat, flooding) to protect operations, employees, and ensure GDP The Climate Transition Plan applies to Redcare Pharmacy N.V.",False,False,No Tier 1 or Tier 2 keyword match,No,,
REC048,Redcare Pharmacy,2025,56,"In addition, there are financial risks associated with erode trust and could lead to loss of business or fines. On the other hand, political incidents involving our pharmaceutical products and services that may cause engagement that aligns with advancing the digital health system presents a positive negative health outcomes for individuals. impact.",False,False,No Tier 1 or Tier 2 keyword match, No,,
REC049,AO World,2023,43,trade and could affect our reputation. This could be further impacted by significant erosion of our leadership The loss of sensitive information relating to strategic direction or team and/or not having the right amount and capability of dedicated business performance may compromise our future strategies or the people across the Group. loss of data relating to individuals may result in regulatory complaints/ investigations and negative publicity.,False,False,No Tier 1 or Tier 2 keyword match, No,,
REC050,AO World,2024,80,"have in the past and will continue in the future We use the inspections and a range of KPIs to to specifically highlight to our search partner monitor the performance in each business unit. that increasing the diversity of the Board, in all Maintaining our health and safety accreditations aspects, is an important consideration with these and management systems allows us to measure our appointments and will have diversity requirements performance using external benchmarks. for candidate shortlists with a view to increasing female and ethnically diverse representation.",False,False,No Tier 1 or Tier 2 keyword match, No,,
REC051,AO World,2022,60,"Against this, AO agility (“COTS”) products. have placed additional focus on this The majority of customer area over the past year, particularly orders are taken through All self-built applications Relevant through the recruitment of specialist our proprietary websites, are built with high levels of strategic pillar cyber security roles, although further and, therefore, significant redundancy, operational investment is needed. 1 2 3 downtime as a result of monitoring, active alerting, a successful systems security controls and fault Through the year, we have continued to breach or failure would tolerance.",False,False,No Tier 1 or Tier 2 keyword match, No,,
REC052,HelloFresh,2024,6,"In addition, we have also made great progress in further diversifying our TAM and revenues with our still early-stage forays into pet food, premium butchery services and most recently into health supplements. While these are still comparably small, we are excited about these markets and the growth opportunities they offer to develop HelloFresh into a diversified, digital-native FMCG company over the next decade. We believe it is helpful to pause for a second and put our 2024 results in perspective over a 5-year trajectory.",False,False,No Tier 1 or Tier 2 keyword match, No,,
REC053,HelloFresh,2024,43,"In addition, we notice somewhat weakening consumer confidence in North America. For our International segment we expect a slightly negative to slightly positive constant currency revenue growth, driven by a less pronounced reduction in meal kit marketing spend. Within the RTE product group we expect to grow constant currency revenue at a low to mid-teens percentage rate.",False,False,No Tier 1 or Tier 2 keyword match, No,,
REC054,HelloFresh,2023,78,"The remaining balance of other financial liabilities (current) is related to interest payable on long-term debt, derivative financial liabilities and credit card liabilities. Trade payables have increased to MEUR 560.2 in 2023 (2022: MEUR 557.6) and primarily comprise balances payable to ingredient suppliers, carriers, partners providing warehousing, packaging providers and providers of marketing services. There was no default in the payment of any of the financial liabilities.",False,False,No Tier 1 or Tier 2 keyword match,No,,
REC055,Westwing,2022,106,"Consolidated Statement of Cash Flows CONSOLIDATED STATEMENT OF CASH FLOWS EURm Notes 2022 2021 Cash flows from operating activities: Profit/loss before tax –30.3 19.0 Adjustments for: Depreciation and impairment of property, plant, and equipment 12 12.2 9.2 Amortization and impairment of intangible assets 13 5.8 3.8 Loss/(gain) on disposal of property, plant, and equipment 0.2 0.2 Share–based payment expenses/(income) 19 –0.6 5.6 Fair value (gain)/loss on financial liabilities – 0.1 Finance income 10 –0.0 –0.1 Finance costs 10 2.0 1.5 Changes in other assets* 3.3 –1.5 Changes in other liabilities* 3.7 3.3 Changes in provisions 21 –0.8 –3.3 Operating cash flows before changes in working capital * –4.5 37.8 Adjustments for changes in working capital: Changes in trade receivables and other financial assets* 14 –0.8 5.9 Changes in inventories* 15 18.2 –28.9 Changes in trade and other payables* –23.0 14.4 Cash flows from operating activities* –10.2 29.2 Tax received/(paid) 2.7 –11.1 Net cash flows from operating activities* –7.5 18.1 Investing activities: Proceeds from sale of property, plant, and equipment 0.0 0.0 Purchase of property, plant, and equipment 12 –3.7 –6.3 Purchase of and investments in intangible assets 13 –10.2 –8.6 Lease deposits 2.5 –1.1 Net cash flows from investing activities –11.4 –16.0 Financing activities: Proceeds from capital increase/sale of equity instruments – 0.4 Interest and other finance charges paid –2.0 –1.6 Supplier finance arrangements 7.8 – Payments of lease liabilities –9.5 –6.4 Purchase of treasury shares 18 –0.5 – Purchase of own equity instruments – –2.1 Contribution of right–of–use assets 1.5 – Net cash flows from financing activities –2.7 –9.7 Net change in cash and cash equivalents –21.5 –7.6 Effect of exchange rate fluctuations on cash held* 0.1 0.1 Cash and cash equivalents as of January 1 17 97.4 104.9 Cash and cash equivalents as of December 31 76.0 97.4 * Prior-year figures adjusted. To add clarity to the development of net working capital, we have shown the changes in other liabilities and other assets separately. 106 WESTWING GROUP SE",False,False,No Tier 1 or Tier 2 keyword match, No,,
REC056,Westwing,2021,120,"The excess amount of EUR 0.8m was recognized in capital reserves. Two capital increases were made in 2020; these related to the exercise of the GGC and 2017 Kreos warrants in October 2020. The exercise of the 2017 Kreos warrant resulted in 9,792 new shares and that of the GGC warrant in 93,750 new shares.",False,False,No Tier 1 or Tier 2 keyword match, No,,
REC057,Westwing,2023,132,"GENERAL AND ADMINISTRATIVE EXPENSES EURm 2023 2022 Personnel expenses – 53.9 – 57.6 Depreciation and amortisation – 10.7 – 10.1 Other expenses – 20.6 – 25.1 Total – 85.2 – 92.9 Other expenses primarily consist of legal, consulting, maintenance, IT and travel expenses. The following expenses were included in general and administrative expenses: EURm 2023 2022 Auditor’s remuneration Audit costs in accordance with section 314(1) no. 9a of the HGB – 0.4 – 0.4 Of which relating to previous periods: EUR 5k (2022: EUR 0k) – 0.0 – Other assurance services in accordance with section 314(1) no.",False,False,No Tier 1 or Tier 2 keyword match,No,,
REC058,Zalando,2024,141,"The member of the audit committee Matti Ahtiainen has the requisite expertise in the area of accounting. He started his professional career as an accountant after graduating from the Helsinki School of Economics. In recent years, Matti Ahtiainen has held positions of responsibility in the finance department at various companies, where he has gained specialist knowledge and experience in the application of accounting principles and in internal controlling and risk management systems.",False,False,No Tier 1 or Tier 2 keyword match,No,,
REC059,Zalando,2025,144,"By engaging with a relevant sample of diverse stakeholder groups to refine and assess the IROs, we obtained comprehensive insights into their key concerns. The interviews provided a comprehensive understanding of stakeholder perspectives, which are crucial for informing our sustainability strategy and decision-making processes. The table below summarises how we engaged with the different stakeholder groups and the main outcomes of our engagements on the DMA.",False,False,No Tier 1 or Tier 2 keyword match,No,,
REC060,Zalando,2023,240,"1 Company 2 Combined management 3 Consolidated financial 4 Other information 240 report statements and service The impact on other comprehensive income by currency breaks down as follows: Foreign currency sensitivity on other comprehensive income 2023 Impact on other comprehensive income IN EUR M CHF CZK GBP NOK PLN SEK USD Total FX rate as Dec 31, 2023 0.9260 24.7240 0.8691 11.2405 4.3395 11.0960 1.1050 5% increase in FX rate -35.0 -8.0 -1.3 -8.6 -15.7 -7.3 11.8 -64.2 5% decrease in FX rate 35.0 8.0 1.3 8.6 15.7 7.3 -11.8 64.2 Foreign currency sensitivity on other comprehensive income 2022 Impact on other comprehensive income IN EUR M CHF CZK GBP NOK PLN SEK USD Total FX rate as Dec 31, 2022 0.9847 24.1160 0.8869 10.5138 4.6808 11.1218 1.0666 5% increase in FX rate -35.3 -8.4 0.0 -10.7 -11.9 -8.9 11.6 -63.6 5% decrease in FX rate 35.3 8.4 0.0 10.7 11.9 8.9 -11.6 63.6 Zalando is currently not exposed to any material interest rate risk that might arise from interest rate fluctuations on the earnings, equity or cash flow for the current or future reporting period. Credit risk Credit risk is the risk of a customer or contractual partner defaulting on payment, resulting in the assets, financial assets or receivables reported in the consolidated statement of financial position having to be written down. Credit risks primarily concern trade and other receivables.",False,False,No Tier 1 or Tier 2 keyword match,No,,
